{
  "schemaVersion": "obiara.readiness-handoff.v1",
  "generatedAt": "2026-07-27T13:00:00Z",
  "expiresAt": "2026-07-27T15:00:00Z",
  "environment": "production",
  "market": "GH",
  "evidence": [
    {
      "requirementId": "credential.runtime-account-custody",
      "kind": "credential",
      "provenance": "credential-custodian",
      "evidenceRef": "0000000000000000000000000000000000000000000000000000000000000001",
      "issuerRef": "role/credential-owner",
      "reviewerRef": "role/security-reviewer",
      "outcome": "pending",
      "synthetic": true,
      "collectedAt": "2026-07-27T13:00:00Z",
      "expiresAt": "2026-07-28T13:00:00Z"
    },
    {
      "requirementId": "store.play-account-custody",
      "kind": "store",
      "provenance": "store-console",
      "evidenceRef": "0000000000000000000000000000000000000000000000000000000000000002",
      "issuerRef": "role/mobile-owner",
      "reviewerRef": "role/security-reviewer",
      "outcome": "pending",
      "synthetic": true,
      "collectedAt": "2026-07-27T13:00:00Z",
      "expiresAt": "2026-07-28T13:00:00Z"
    },
    {
      "requirementId": "store.app-account-custody",
      "kind": "store",
      "provenance": "store-console",
      "evidenceRef": "0000000000000000000000000000000000000000000000000000000000000003",
      "issuerRef": "role/mobile-owner",
      "reviewerRef": "role/security-reviewer",
      "outcome": "pending",
      "synthetic": true,
      "collectedAt": "2026-07-27T13:00:00Z",
      "expiresAt": "2026-07-28T13:00:00Z"
    },
    {
      "requirementId": "store.signing-ceremony",
      "kind": "store",
      "provenance": "signing-witness",
      "evidenceRef": "0000000000000000000000000000000000000000000000000000000000000004",
      "issuerRef": "role/signing-custodian",
      "reviewerRef": "role/signing-witness",
      "outcome": "pending",
      "synthetic": true,
      "collectedAt": "2026-07-27T13:00:00Z",
      "expiresAt": "2026-07-28T13:00:00Z"
    },
    {
      "requirementId": "cohort.uat-consent",
      "kind": "cohort",
      "provenance": "cohort-review",
      "evidenceRef": "0000000000000000000000000000000000000000000000000000000000000005",
      "issuerRef": "role/uat-owner",
      "reviewerRef": "role/privacy-reviewer",
      "outcome": "pending",
      "synthetic": true,
      "collectedAt": "2026-07-27T13:00:00Z",
      "expiresAt": "2026-07-28T13:00:00Z"
    },
    {
      "requirementId": "cohort.uat-training",
      "kind": "cohort",
      "provenance": "cohort-review",
      "evidenceRef": "0000000000000000000000000000000000000000000000000000000000000006",
      "issuerRef": "role/uat-owner",
      "reviewerRef": "role/safety-reviewer",
      "outcome": "pending",
      "synthetic": true,
      "collectedAt": "2026-07-27T13:00:00Z",
      "expiresAt": "2026-07-28T13:00:00Z"
    },
    {
      "requirementId": "cohort.uat-completion",
      "kind": "cohort",
      "provenance": "cohort-review",
      "evidenceRef": "0000000000000000000000000000000000000000000000000000000000000007",
      "issuerRef": "role/uat-owner",
      "reviewerRef": "role/product-reviewer",
      "outcome": "pending",
      "synthetic": true,
      "collectedAt": "2026-07-27T13:00:00Z",
      "expiresAt": "2026-07-28T13:00:00Z"
    },
    {
      "requirementId": "operations.circle-coverage",
      "kind": "operations",
      "provenance": "operations-review",
      "evidenceRef": "0000000000000000000000000000000000000000000000000000000000000008",
      "issuerRef": "role/community-owner",
      "reviewerRef": "role/launch-reviewer",
      "outcome": "pending",
      "synthetic": true,
      "collectedAt": "2026-07-27T13:00:00Z",
      "expiresAt": "2026-07-28T13:00:00Z"
    },
    {
      "requirementId": "operations.host-readiness",
      "kind": "operations",
      "provenance": "operations-review",
      "evidenceRef": "0000000000000000000000000000000000000000000000000000000000000009",
      "issuerRef": "role/community-owner",
      "reviewerRef": "role/safety-reviewer",
      "outcome": "pending",
      "synthetic": true,
      "collectedAt": "2026-07-27T13:00:00Z",
      "expiresAt": "2026-07-28T13:00:00Z"
    },
    {
      "requirementId": "operations.support-coverage",
      "kind": "operations",
      "provenance": "operations-review",
      "evidenceRef": "000000000000000000000000000000000000000000000000000000000000000a",
      "issuerRef": "role/support-owner",
      "reviewerRef": "role/launch-reviewer",
      "outcome": "pending",
      "synthetic": true,
      "collectedAt": "2026-07-27T13:00:00Z",
      "expiresAt": "2026-07-28T13:00:00Z"
    },
    {
      "requirementId": "operations.trust-safety-coverage",
      "kind": "operations",
      "provenance": "operations-review",
      "evidenceRef": "000000000000000000000000000000000000000000000000000000000000000b",
      "issuerRef": "role/safety-owner",
      "reviewerRef": "role/launch-reviewer",
      "outcome": "pending",
      "synthetic": true,
      "collectedAt": "2026-07-27T13:00:00Z",
      "expiresAt": "2026-07-28T13:00:00Z"
    }
  ]
}
